0,Các chuyên đề xây dựng thuộc các lĩnh vực nào?,hướng tới chuẩn đầu ra quốc tế nhằm hướng tới chuẩn đầu ra quốc tế và đổi mới chương trình đào tạo của khoa theo hướng tiếp cận cdio
0,Phòng thanh tra có nhiệm vụ gì đối với chính sách pháp luật?,tham mưu cho hiệu trưởng việc phân phối tài sản cơ sở vật chất cho các đơn vị sử dụng và giám sát việc quản lý sử dụng đúng chức năng
1,Email của Bộ môn Tiếng Anh là gì,email: bm.tienganh@nuce.edu.vn
1,trường đại học xây dựng hà nội đã huy động ai để xây dựng bộ chuyên đề?,các giáo sư đầu ngành và chuyên gia nhiều kinh nghiệm
1,"đối với sinh viên chưa tốt nghiệp chương trình cử nhân, họ sẽ sử dụng tài khoản nào?",sử dụng tài khoản là mã sinh viên cũ để đăng ký các học phần chưa đạt
0,"Theo các chuyên gia, khi nào xu hướng xây dựng và phát triển bất động sản sẽ kéo dài?",kiến thức chuyên sâu về nguyên tắc tổ chức không gian quy luật thẩm mỹ về hình khối phối cảnh bố cục
1,thời gian đăng ký học phần kỳ 3 là khi nào?,từ ngày 22/04/2024 đến 26/04/2024
1,Bộ môn Tiếng Anh đã có thành tựu gì trong nghiên cứu khoa học,cán bộ bộ môn tiếng anh là tác giả của các đề tài nghiên cứu khoa học cấp trường tham gia hội thảo và các khóa học trong nước và quốc tế với 100 cán bộ giảng dạy có trình độ thạc sỹ trở lên
0,Các cơ hội học bổng dành cho sinh viên là gì?,đầu giờ học thực hành phải kiểm tra tình trạng máy tính nếu máy có dấu hiệu hỏng hóc thiết bị phải báo cáo ngay
1,Bộ môn Tiếng Anh có quan hệ hợp tác với các đơn vị nào,bộ môn tiếng anh xây dựng và phát triển quan hệ hợp tác với các đơn vị trong và ngoài trường
1,Quy mô tuyển sinh của chương trình đào tạo văn bằng hai vừa làm vừa học là bao nhiêu,quy mô tuyển sinh: 150 sinh viên/năm học
0,Nhiệm vụ phòng chống thiên tai và tìm kiếm cứu nạn của phòng bảo vệ là gì?,phối hợp làm thủ tục tang lễ khi cán bộ viên chức sinh viên của trường qua đời
0,Phòng Quản trị Thiết bị được thành lập như thế nào?,phòng thanh tra pháp chế có chức năng tham mưu giúp việc cho hiệu trưởng về công tác thanh tra nội bộ và những vấn đề pháp lý của trường
1,các đối tác của pfiev ở phía pháp là ai,một tổ hợp các trường đại học lớn là đối tác của pfiev được thành lập để tư vấn cho chương trình gồm trường quốc gia cầu đường paris viện quốc gia khoa học ứng dụng lyon trường trung tâm paris viện quốc gia bách khoa grenoble
0,Ban quản lý ký túc xá có đề xuất mô hình quản lý theo hướng hiện đại không?,cơ cấu tổ chức bộ môn ngoại ngữ gồm hai tổ: tổ tiếng anh và tổ tiếng pháp với 25 cán bộ giảng dạy và 01 thư ký bộ môn.
1,sinh viên phải đăng ký bảo lưu điểm trước ngày nào?,trước ngày 05/05/2024
1,ban giám hiệu giao nhiệm vụ cho các đơn vị nào trong công tác đánh giá?,"giao nhiệm vụ cho phòng ctctqlsv, trung tâm công nghệ thông tin, các khoa/ban"
1,Ký túc xá có đảm bảo an ninh không,ký túc xá luôn duy trì nề nếp an ninh và trật tự an toàn xã hội
1,sinh viên được hỗ trợ gì trong suốt thời gian học?,học ngoại ngữ miễn phí
1,thời gian sinh viên đánh giá kết quả rèn luyện là khi nào?,từ ngày 09/9/2024 đến 16/9/2024
1,giáo viên chủ nhiệm phê duyệt kết quả đánh giá ở đâu?,trên phần mềm tại địa chỉ htftpseoffice.huce.edu.vn
0,Sinh viên tốt nghiệp có thể đảm nhiệm vai trò gì trong doanh nghiệp xây dựng cầu đường?,liên hệ khoa công nghệ thông tin hotline: 0962105353 ts. dương diệp thúy 0919939666 ths. nguyễn xuân linh fanpage: https://www.facebook.com/cnttdhxd website: https://fit.huce.edu.vn văn phòng: phòng 410 nhà a1 trường đại học xây dựng hà nội
0,Ngành kỹ thuật cơ khí chuyên ngành máy xây dựng đóng vai trò gì trong xã hội?,các cán bộ kỹ thuật ngành kỹ thuật cơ khí chuyên ngành máy xây dựng luôn giữ vai trò quan trọng không thể thiếu trong xã hội
1,thông báo miễn giảm học phần áp dụng cho sinh viên khóa nào,sinh viên k.69 lt20
1,Khu ký túc xá có bao nhiêu phòng,khu nội trú có 145 phòng
0,Bộ môn tiếng Anh có tổ chức đào tạo bồi dưỡng nâng cao trình độ cho giảng viên không?,tổ hành chính: quản lý từng dãy nhà làm việc trực tiếp với sinh viên. tổ vệ sinh môi trường: đảm bảo vệ sinh cho khu vực ktx. tổ bảo vệ: thực hiện công tác bảo vệ an toàn an ninh trong toàn ký túc xá. tổ điện nước: quản lý sửa chữa bảo quản vận hành phân phối điện nước cho ký túc xá.
0,Tình hình nghiên cứu khoa học của khoa trong năm học 2014-2015 như thế nào?,triển khai nghị quyết của đảng ủy và ban giám hiệu nhà trường về việc công tác đào tạo gắn liền với thực tiễn sản xuất nhu cầu xã hội.
0,Sinh viên có kỹ năng gì khi tốt nghiệp?,kỹ năng sử dụng tin học và ngoại ngữ để giải quyết công việc đủ năng lực và phẩm chất cần thiết để tham gia thị trường lao động quốc tế
1,Trường Đại học Xây dựng Hà Nội là trường đại học đa ngành không,trường đại học xây dựng hà nội đã trở thành một trường đại học đa ngành
0,Sinh viên có cơ hội nhận học bổng gì đặc biệt?,thăm quan thực tập tại các công ty tổng công ty lớn trong lĩnh vực cơ điện
1,quy trình cấp chứng chỉ bắt đầu từ bước nào,công bố danh sách sinh viên đủ điều kiện cấp chứng chỉ
1,Trường Đại học Xây dựng Hà Nội có bao nhiêu nhà giáo được phong tặng danh hiệu nhà giáo ưu tú,trường có 67 nhà giáo được phong tặng danh hiệu nhà giáo ưu tú
0,Viện công nghệ cao Việt Nhật hoạt động theo quy định của những văn bản nào?,quyết định chuyển đổi: số 33qđbgdđt ngày 05/01/2009
0,Phòng Hành chính Tổng hợp được thành lập khi nào và hiện có bao nhiêu CBVC?,phòng bảo vệ có chức năng tham mưu giúp hiệu trưởng thực hiện quản lý về công tác bảo vệ an ninh trật tự an toàn xã hội
1,Thời gian đào tạo của chương trình đại học vừa làm vừa học là bao lâu,chương trình đào tạo được thiết kế 5 năm 10 học kỳ trong đó 9 học kỳ tích lũy học phần 1 học kỳ làm đồ án tốt nghiệp
0,Mục tiêu đào tạo của khoa là gì?,tham gia huấn luyện các câu lạc bộ các đội tuyển thể thao của trường thi đấu các giải thể thao sinh viên
0,Cơ cấu tổ chức của viện công nghệ cao Việt Nhật bao gồm những gì?,cơ cấu tổ chức hội đồng khoa học và đào tạo. ban lãnh đạo viện: viện trưởng các phó viện trưởng và kế toán trưởng
1,quyết định này có tác động như thế nào đến tiến trình học tập của sinh viên?,tạo điều kiện thuận lợi cho sinh viên trong tiến trình học tập và chuẩn đầu ra ngoại ngữ
0,Viện KHCN CTT thiết kế công nghệ trong lĩnh vực nào?,cung cấp các dịch vụ tư vấn về khoa học và chuyển giao công nghệ tổ chức hội nghị hội thảo khoa học triển khai thực nghiệm và sản xuất thử nghiệm
1,công tác đánh giá kết quả rèn luyện của sinh viên được triển khai từ khóa nào đến khóa nào?,triển khai từ k64 đến k68
1,công ty có cung cấp tư vấn về công nghệ không?,tư vấn về công nghệ
0,Thời gian đào tạo ngành kỹ thuật điện là bao lâu?,có năng lực hình thành ý tưởng thiết kế triển khai vận hành các công trình công nghệ hệ thống phức tạp trong kỹ thuật môi trường
1,tỷ lệ cán bộ hợp đồng theo nghị định 68 so với tổng số cán bộ là bao nhiêu?,tỷ lệ cán bộ hợp đồng theo nghị định 68 là 5.54%
1,quyết định số 150/qđđhxd có liên quan đến chương trình nào của sinh viên?,chương trình đào tạo sinh viên đại học hệ chính quy
1,điều gì được quy định trong quyết định số 144/cp?,thành lập trường đại học xây dựng
1,đội ngũ giảng viên của trường có bao nhiêu nhà giáo ưu tú?,67
1,"sinh viên k67, k68 cần có điểm gì để đăng ký bảo lưu?",điểm trung bình các bài đánh giá thường xuyên từ 55 trở lên
1,trường đại học xây dựng hà nội đã chủ trương xây dựng hệ đào tạo liên tục vào năm nào?,năm 2001
1,số nhà giáo ưu tú trong đội ngũ giảng viên của trường là bao nhiêu?,số nhà giáo ưu tú là 67
1,sinh viên tự đánh giá kết quả rèn luyện của mình trên phần mềm nào?,trên phần mềm tại địa chỉ https://sinhvien.huce.edu.vn
1,trường đại học xây dựng hà nội được người học đánh giá như thế nào về chương trình đào tạo?,được người học đánh giá cao về chương trình đào tạo
0,Sinh viên có cơ hội nhận học bổng từ đâu?,cơ hội nhận học bổng khuyến khích của trường đại học xây dựng hà nội khoa cơ khí
0,Sinh viên được trang bị thêm kiến thức gì liên quan đến chuyên ngành?,có khả năng sử dụng nhiều công nghệ mới ví dụ như công nghệ bim ar vr computer vision các phần mềm hiện đại như revit tekla
0,Nhiệm vụ của phòng trong việc sử dụng hội trường và phòng họp là gì?,tham gia phối hợp với công an tổ chức kiểm tra theo định kỳ và đột xuất nhân khẩu thường trú tạm trú trong khu tập thể trường
1,công ty có quyền sử dụng phòng thí nghiệm nào?,công ty có quyền được sử dụng các phòng thí nghiệm của trường đại học xây dựng
0,Tổ chức nhân sự của phòng bảo vệ gồm những ai?,cơ cấu tổ chức trưởng phòng: gvc.ths phạm văn du phó trưởng phòng: gv.ths nguyễn thị lan hương phó trưởng phòng: gv.ths trịnh
1,hình thức xử lý khiển trách được áp dụng trong trường hợp nào?,hình thức xử lý khiển trách được áp dụng khi sinh viên vi phạm quy định trong thi cử lần đầu
1,sinh viên cần nộp hồ sơ miễn giảm ở đâu,phòng 302 nhà a1
1,Bộ môn Tiếng Anh quản lý cơ sở vật chất của bộ môn không,bộ môn tiếng anh quản lý cơ sở vật chất của bộ môn
1,số thạc sĩ trong đội ngũ giảng viên của trường là bao nhiêu?,số thạc sĩ là 429
1,sinh viên có thể đăng ký học phần nào trong kỳ 3?,"các môn học chưa đạt, sinh viên có thể trả nợ các môn học chưa đạt"
1,sinh viên cần xem thông tin giảng viên phụ trách ở đâu,sinh viên xem thời khóa biểu thông tin giảng viên phụ trách lớp học phần trên cổng thông tin sinh viên
1,quyết định có hiệu lực từ ngày nào?,kể từ ngày ký
0,Phòng thúc đẩy đổi mới trong giáo dục ra sao?,chủ trì việc tổ chức và tham gia quản lý thực hiện dự án đầu tư quản lý việc thanh quyết toán vốn đầu tư dự án
0,Phòng Thanh tra Pháp chế có chức năng gì?,phòng quản trị thiết bị được thành lập gắn liền với quá trình thành lập và phát triển của trường đại học xây dựng hà nội
0,Tạp chí đã khẳng định được vị thế ở đâu?,năm 2016 nhân kỷ niệm 60 năm đào tạo 50 năm thành lập trường đại học xây dựng hà nội
1,thời gian sinh viên đánh giá kết quả rèn luyện là khi nào?,từ ngày 09/9/2024 đến 16/9/2024
0,Phòng thực hiện công việc liên quan đến thiết kế và dự toán ra sao?,xây dựng hướng dẫn và giám sát thực hiện quy chế đào tạo quy định tổ chức và quản lý đào tạo nhằm đảm bảo hệ thống đào tạo vận hành hiệu
1,trường đang mở các lớp đào tạo liên tục nào?,bồi dưỡng nghiệp vụ giám sát thi công xây dựng công trình dân dụng công nghiệp và hạ tầng kỹ thuật giao thông thủy lợi thủy điện
0,Các quốc gia nào có chương trình trao đổi sinh viên?,không được sử dụng máy tính vào các mục đích khác như chơi game chat nghe nhạc xem phim hay truy cập vào các trang
1,điều kiện để người học tham dự thi kết thúc học phần là gì?,người học được tham dự thi kết thúc học phần khi đáp ứng đồng thời các điều kiện hoàn thành nghĩa vụ học phí điểm quá trình lớn hơn 0 không vi phạm quy chế học tập
1,sinh viên cần phải đóng học phí qua ngân hàng nào?,agribank
1,Quyết định nào liên quan đến tổ chức thi đánh giá trình độ ngoại ngữ tại Trường Đại học Xây dựng,căn cứ quyết định số 1571/qđ-dhxd/đt của hiệu trưởng trường đại học xây dựng về phê duyệt đề án tổ chức thi đánh giá trình độ ngoại ngữ nội bộ trường đại học xây dựng
0,Đội ngũ cán bộ của khoa có bao nhiêu người?,khoa đã thiết lập được hệ thống các đối tác chiến lược về đào tạo nghiên cứu khoa học
0,Trường đã nhận bao nhiêu huy chương vì sự nghiệp giáo dục?,phó tổng biên tập được ký thừa lệnh hiệu trưởng những văn bản do tổng biên tập uỷ quyền
1,Ban quản lý ký túc xá có trách nhiệm gì liên quan đến an toàn phòng cháy chữa cháy,ban quản lý ký túc xá chủ trì phối hợp với các đơn vị có liên quan tổ chức thực hiện công tác phòng cháy chữa cháy
0,Bộ môn tiếng Anh có tổ chức các chương trình nào cho giảng viên?,quy mô tuyển sinh: 150 sinh viên/năm học ngành và chuyên ngành đào tạo: các ngành và chuyên ngành đào tạo vừa làm vừa học của trường đhxdhn hình thức tuyển sinh: xét tuyển thời điểm thi tuyển sinh: theo kế hoạch tuyển sinh hàng năm
0,Khoa giáo dục thể chất và quốc phòng tham mưu cho ai trong công tác quốc phòng?,phó gs gs: 8
0,Các phương thức tuyển sinh của Đại học Xây dựng Hà Nội bao gồm những gì?,Sản xuất sắt thép gang.
0,Mỹ thuật đô thị thể hiện qua những yếu tố nào?,quyết định này có hiệu lực kể từ ngày ký
0,Phòng thí nghiệm của Viện KHCN CTT có những gì?,năm 2014 viện khktmt chuyển đổi sang hoạt động theo cơ chế tự hạch toán theo nghị định 115nđcp
1,đào tạo và bồi dưỡng đội ngũ cán bộ viên chức có được coi trọng trong nhà trường không?,đào tạo và bồi dưỡng đội ngũ cán bộ viên chức là công việc được đặc biệt coi trọng của nhà trường
0,Bộ môn tiếng Anh tại Đại học Xây dựng Hà Nội có những thành tựu gì trong nghiên cứu khoa học?,sinh viên phải học bổ sung các môn học còn thiếu so với các môn học yêu cầu ở trình độ cao đẳng của ngành chuyên ngành đăng ký.
1,sinh viên cần liên hệ ai nếu còn nợ lệ phí phụ thu học phần quốc phòng an ninh,phòng tài vụ
0,Thư viện có bao nhiêu người và chia thành mấy tổ?,đẩy mạnh công tác liên kết đào tạo bồi dưỡng nguồn nhân lực đạt chuẩn khu vực và quốc tế đáp ứng nhu cầu học tập đa dạng
1,mỗi khóa học đào tạo kỹ sư bậc cao của trường kéo dài bao lâu?,3 tháng
0,Khoa đã đăng ký bao nhiêu đề tài nghiên cứu khoa học trong năm học 2014-2015?,tuyển bóng đá tuyển bóng rổ tuyển bóng chuyền tuyển bóng bàn tuyển cầu lông tuyển điền kinh
0,Viện KHCN CTT thiết kế công trình gì?,thực hiện các khóa đào tạo nâng cao trình độ và chuyển giao công nghệ thuộc lĩnh vực kỹ thuật cao
1,chương trình học chuyển tiếp này là chương trình gì?,chương trình đào tạo kỹ sư kiến trúc sư thạc sĩ
1,yêu cầu đối với người học khi đăng ký đào tạo đại học vlvh là gì?,yêu cầu đối với người học: đã có bằng tốt nghiệp trung học phổ thông
0,Sinh viên ngành kỹ thuật điện có thể thực hành ở đâu?,học bổng từ các doanh nghiệp như công ty phú điền công ty daikin panasonic vietnam công ty inno công ty nhựa minh hùng
0,"Để tham quan thư viện, bạn đọc có thể liên hệ qua những kênh nào?",trung tâm hợp tác đào tạo và tư vấn quốc tế tầng 5 nhà thí nghiệm 10 tầng trường đại học xây dựng hà nội
1,giáo viên chủ nhiệm có trách nhiệm gì trong việc đánh giá?,phê duyệt kết quả đánh giá rèn luyện của sinh viên lớp mình phụ trách
0,Thời gian đào tạo ngành Kỹ thuật xây dựng công trình giao thông là bao lâu?,thời gian đào tạo thiết kế là 5 năm
0,Bộ môn giáo dục thể chất trang bị cho sinh viên những kỹ năng gì?,tại khu vực châu á (nhật bản thái lan malaysia) cũng như châu âu châu mỹ (pháp đức hà lan italia canada)
0,Thông tin liên hệ của phòng Hành chính Tổng hợp là gì?,liên hệ điện thoại: 0243.8696764 088.888.5504
1,thời gian hoàn thành báo cáo kết quả công tác đánh giá là khi nào?,trước ngày 04/10/2024
1,sinh viên muốn chuyển sang hệ vừa làm vừa học cần làm gì?,sinh viên có nguyện vọng chuyển sang vlvh cần có đơn và được sự đồng ý của trưởng phòng đào tạo
1,sinh viên có cơ hội việc làm ở đâu sau khi tốt nghiệp?,trong các doanh nghiệp quốc tế
1,công ty có những chuyên gia nào tham gia?,công ty là nơi hội tụ đông đảo các giáo sư tiến sỹ thạc sỹ kỹ sư và kiến trúc sư
1,ai là người chịu trách nhiệm thi hành quyết định này?,trưởng các đơn vị và cá nhân liên quan chịu trách nhiệm thi hành quyết định này
0,Mã số PISSN của tạp chí là gì?,huân chương hồ chí minh năm 2006
0,Phòng bảo vệ tổ chức tuần tra như thế nào?,thư ký cho ban giám hiệu lập kế hoạch công tác sắp xếp lịch tiếp cán bộ viên chức ghi biên bản họp chuẩn bị văn bản bài
1,sinh viên có thể đăng ký học phần kỳ i năm học 2024-2025 từ bao lâu?,từ ngày 23/6/2024 đến 03/7/2024
0,Bộ môn tiếng Anh tại Đại học Xây dựng Hà Nội có chương trình đào tạo nào cho sinh viên quốc tế không?,Chương trình đào tạo được thiết kế 2.5 năm. Sinh viên phải học bổ sung các môn học còn thiếu so với các môn học yêu cầu ở trình độ cao đẳng của ngành chuyên ngành đăng ký.
0,Sinh viên phải kiểm tra điều gì trước giờ học thực hành?,học bổng học tập tại trường với giảng viên chuyên gia nhiều kinh nghiệm được đào tạo tại các quốc gia tiên tiến đạt giải
1,Quy mô tuyển sinh của chương trình đào tạo đại học vừa làm vừa học là bao nhiêu,quy mô tuyển sinh: 200 sinh viên/năm học
0,Nhà trường đã huy động những ai để xây dựng các chuyên đề?,khoa luôn đi đầu trong việc đổi mới đào tạo mở rộng hợp tác trong nước quốc tế và các hoạt động ngoại khóa của sinh viên
0,Trung tâm có bao nhiêu tầng và văn phòng nằm ở đâu?,tầng 2: phòng học nhóm (450 chỗ ngồi với diện tích 310 m2)
1,chương trình liên kết đào tạo này có ưu điểm gì?,là chương trình liên kết đào tạo đầu tiên của việt nam được phê duyệt với đối tác mỹ trong lĩnh vực kỹ thuật xây dựng
0,Viện KHCN CTT tư vấn về hồ sơ mời thầu như thế nào?,tổ chức hội thảo tư vấn đầu tư lập dự án thiết kế thẩm tra các công trình xây dựng tư vấn nghiệp vụ chuyên môn cung cấp thông tin và đánh giá thị trường
0,Bộ môn tiếng Anh tại Đại học Xây dựng Hà Nội có tổ chức các chương trình học tiếng Pháp không?,Đào tạo: chương trình đào tạo được thiết kế 5 năm 10 học kỳ trong đó 9 học kỳ tích lũy học phần 1 học kỳ làm đồ án tốt nghiệp thời gian đào tạo: tối đa 10 năm.
1,sinh viên cần làm gì trong công tác đánh giá?,tự đánh giá kết quả rèn luyện bản thân trên phần mềm
1,sinh viên có thể đăng ký học phần qua cổng thông tin nào?,qua cổng thông tin sinh viên của trường
0,Sứ mệnh của trung tâm hợp tác đào tạo và tư vấn quốc tế là gì?,"thư viện có 18 người, bao gồm ban giám đốc (02 người) và 16 cán bộ viên chức chia làm 4 tổ chuyên môn nghiệp vụ"
1,phòng nào là đơn vị đầu mối lập kế hoạch triển khai công tác đánh giá?,phòng ctctqlsv
1,các học phần thực hành thí nghiệm được xử lý như thế nào,giảng viên chủ động ngưng lịch và bố trí lịch dạy bù vào các tuần tiếp theo
1,số giảng viên cao cấp và giảng viên chính trong đội ngũ giảng viên của trường là bao nhiêu người?,311
1,bộ xây dựng đã công nhận trường có khả năng bồi dưỡng nghiệp vụ cho bao nhiêu lĩnh vực?,3 lĩnh vực
0,Sinh viên ngành kiến trúc nội thất có thể làm công việc gì sau khi tốt nghiệp?,sinh viên có cơ hội nhận các học bổng khuyến khích học tập học bổng đỗ quốc sam học bổng dành cho sinh viên xuất sắc
0,Sinh viên học bao nhiêu học phần giáo dục thể chất?,các buổi nói chuyện của các kts nổi tiếng thế giới các hội thảo quốc tế về đào tạo
1,công ty có sản xuất sản phẩm điện tử dân dụng không?,sản xuất sản phẩm điện tử dân dụng
1,trường có bao nhiêu giáo sư trong đội ngũ giảng viên?,20
0,Phòng chịu trách nhiệm gì về sửa chữa và bảo trì các thiết bị của trường?,phối hợp với các đơn vị có liên quan xây dựng và trình hiệu trưởng ban hành các văn bản quản lý của trường về thanh tra
1,đối tượng nào được cấp chứng chỉ giáo dục quốc phòng an ninh,tất cả sinh viên đã hoàn thành các học phần giáo dục quốc phòng an ninh
1,công tác đánh giá kết quả rèn luyện được triển khai từ khóa nào?,từ k64 đến k68
0,Tạp chí thuộc hệ thống trích dẫn nào?,công đoàn trường đhxdhn được nhà nước trao tặng hai huân chương lao động hạng nhì và hạng ba
0,Thư viện có bao nhiêu tầng và diện tích sử dụng bao nhiêu m2?,tư vấn kỹ thuật chuyên ngành cho các bộ cơ quan tổ chức doanh nghiệp tại việt nam
1,sinh viên nào có thể đăng ký bảo lưu điểm?,"sinh viên k66 trở về trước có điểm tổng kết học phần loại f, d, d+ và có điểm quá trình từ 5 trở lên"
1,Bộ môn Tiếng Anh có nhiệm vụ gì khác,bộ môn tiếng anh thực hiện các nhiệm vụ khác do hiệu trưởng giao
0,Thư viện tham gia những hoạt động gì ngoài đào tạo?,tổ chức các chương trình trao đổi kinh nghiệm và học tập ngắn hạn thực tập tại các trường đại học nước ngoài
0,Thời gian đào tạo và cấp bằng của ngành là bao lâu?,người tốt nghiệp được cấp bằng kỹ sư tương đương trình độ bậc 7 theo khung trình độ quốc gia việt nam với thời gian đào tạo thiết kế là 5 năm
