0,Sinh viên có thể tham gia những hoạt động gì để rèn luyện kỹ năng mềm?,cơ hội tham gia các hoạt động để rèn luyện kỹ năng mềm trong các hoạt động đoàn thể như sinh viên tình nguyện câu lạc bộ robocon hoạt động văn hóa và thể thao
1,mức học phí cho chương trình đào tạo thạc sĩ là bao nhiêu?,725.000đ/tín chỉ
1,trường có bao nhiêu phó giáo sư trong đội ngũ giảng viên?,99
0,Ngành bất động sản đóng vai trò gì trong nền kinh tế?,ngành đào tạo kiến trúc nội thất là một ngành đặc thù nằm giữa hai lĩnh vực nghệ thuật và kỹ thuật
0,Mỹ thuật đô thị là gì?,căn cứ luật giáo dục đại học ngày 18 tháng 6 năm 2012 và luật sửa đổi bổ sung một số điều của luật giáo dục đại học
1,sinh viên muốn lấy bằng kỹ sư kiến trúc sư cần làm gì?,học tiếp sau khi có bằng cử nhân
1,thời gian duyệt kết quả đánh giá của giáo viên chủ nhiệm là khi nào?,từ ngày 14/03/2024 đến 18/03/2024
1,Trường Đại học Xây dựng Hà Nội được công nhận đạt chuẩn kiểm định chất lượng trong bao lâu,trường đại học xây dựng hà nội được công nhận đạt chuẩn kiểm định chất lượng có thời hạn 5 năm (6/2017 6/2022)
0,Trưởng phòng Quản lý Đào tạo được phép ký gì?,ths. cao tuấn anh trưởng phòng nguyễn đức thành chuyên viên hoàng thị quỳnh chuyên viên nguyễn thị tuệ minh chuyên viên hứa thanh tùng
0,Thông tin liên hệ của Phòng Quản lý Đào tạo là gì?,liên hệ phòng 417 nhà a1 trường đại học xây dựng hà nội số điện thoại 024.66803535 website qldt.huce.edu.vn email qldthuce.edu.vn
0,Sinh viên có kỹ năng gì khi tốt nghiệp?,kỹ năng sử dụng tin học và ngoại ngữ để giải quyết công việc đủ năng lực và phẩm chất cần thiết để tham gia thị trường lao động quốc tế
0,Hình thức xử lý khi vi phạm nội quy là gì?,khoa kiến trúc và quy hoạch điện thoại 024 3869 1973 0904 56 ts nguyễn thị lan hương website ktqh.huce.edu.vn email
1,quyết định này áp dụng cho các học phần tiếng anh nào?,các học phần tiếng anh công nhận đạt trình độ ngoại ngữ theo tiến trình học tập
0,Mục tiêu của trung tâm hợp tác đào tạo và tư vấn quốc tế là gì?,được thực hiện dưới sự chỉ đạo trực tiếp của ban giám hiệu nhà trường
1,sinh viên có thể tốt nghiệp sớm và nhận bằng gì?,cử nhân
1,"số viên chức hướng dẫn thí nghiệm, thực hành của trường là bao nhiêu?","số viên chức hướng dẫn thí nghiệm, thực hành là 46 người"
0,Chương trình đào tạo ngành kỹ thuật điện được xây dựng theo phương pháp nào?,chú trọng giáo dục kiến thức nền tảng về khoa học tự nhiên và kỹ thuật vững chắc
1,hệ đào tạo liên tục của trường được xây dựng theo đặt hàng của ai?,bộ xây dựng
1,công ty có cung cấp dịch vụ giám sát công trình không?,công ty cung cấp dịch vụ tư vấn giám sát công tác xây dựng và hoàn thiện công trình
1,máy tính sinh viên cần có kết nối gì để học trực tuyến,chuẩn bị máy tính có kết nối internet cài đặt phần mềm ms teams
1,nội dung chương trình có tính ứng dụng thực tiễn không?,có tính ứng dụng thực tiễn cao
1,sinh viên có thể nhận hỗ trợ qua kênh nào về đăng ký học phần?,qua điện thoại 024 38696654 hoặc email daotao@huce.edu.vn
0,Kiến thức kỹ năng nổi bật của sinh viên sau khi tốt nghiệp là gì?,có khả năng áp dụng các kiến thức cơ bản về toán khoa học tự nhiên và kỹ thuật
1,sinh viên nhận chứng chỉ tại đâu,tại văn phòng khoa ban quản lý
1,sinh viên không có tài khoản ngân hàng agribank phải đóng học phí ở đâu?,đóng học phí trực tiếp tại phòng tài vụ
1,Cơ cấu tổ chức của ban quản lý ký túc xá gồm những bộ phận nào,"ban quản lý ký túc xá chia thành 04 bộ phận chuyên môn gồm tổ hành chính, tổ vệ sinh môi trường, tổ bảo vệ, tổ điện nước"
0,Thời gian đào tạo ngành kỹ thuật cơ điện là bao lâu?,sinh viên sẽ được trang bị kiến thức chuyên sâu về kinh tế xây dựng quản lý xây dựng và quản lý đô thị
0,Phòng phối hợp với các đơn vị khác để quản lý tài sản ra sao?,là đầu mối giúp hiệu trưởng chỉ đạo về nghiệp vụ và phối hợp với các cơ quan tổ chức đơn vị liên quan về công tác thanh tra
1,thời gian tối đa để hoàn thành chương trình đào tạo đại học vlvh là bao lâu?,thời gian đào tạo: tối đa 10 năm
0,Thời gian trễ tối đa để được vào phòng máy là bao lâu?,người tốt nghiệp được cấp bằng cử nhân tương đương trình độ bậc 6 theo khung trình độ quốc gia việt nam với thời gian
0,Trang phục và tư thế ngồi trong phòng máy được quy định như thế nào?,nhóm môn học cốt lõi ngành khối kiến thức chuyên sâu của chương trình đào tạo với các lý thuyết và thực hành dưới dạng
1,Trường Đại học Xây dựng Hà Nội là trường đại học nào của Việt Nam đạt chuẩn kiểm định chất lượng,trường đại học xây dựng hà nội là một trong bốn trường đại học đầu tiên của việt nam đạt chuẩn kiểm định chất lượng của một tổ chức quốc tế
1,công ty đang triển khai những đề tài nào phục vụ phát triển ngành xây dựng?,sản xuất thanh polyme cốt sợi thay thế một phần cốt thép trong kết cấu bê tông cốt thép
0,Số lượng cán bộ của Phòng Quản lý Đào tạo là bao nhiêu?,trực tiếp lập kế hoạch đầu tư đề xuất phương án tổ chức quản lý đầu tư các dự án từ khâu chuẩn bị dự án đến khâu thực hiện
0,Tỷ lệ sinh viên tốt nghiệp loại giỏi là bao nhiêu?,tham gia hoạt động trong đội sinh viên tình nguyện đội văn nghệ thể thao của khoa trường
1,sinh viên nợ học phí có thể đăng ký học phần không?,sinh viên còn nợ học phí sẽ bị khóa tài khoản đkhp
1,công ty sản xuất những sản phẩm nào?,sản xuất sản phẩm chịu lửa sản phẩm từ plastic thủy tinh đất set
1,thời gian sinh viên phải đóng học phí là trước khi nào?,trước 15h ngày 16/05/2024
1,sinh viên được miễn giảm học phần nào,giáo dục quốc phòng an ninh giáo dục thể chất
0,Các doanh nghiệp nào có cơ hội thực tập cho sinh viên?,cơ hội nhận học bổng và hỗ trợ tham quan thực tập việc làm của các doanh nghiệp như công ty nissan vinalift lilama incosaf licogi vạn xuân anchi komatsu
1,Mục tiêu đào tạo của bộ môn Tiếng Anh là gì,mục tiêu đào tạo đào tạo kỹ sư có khả năng sử dụng thành thạo tiếng anh trong giao tiếp và công việc với đối tác nước ngoài
1,thời gian duyệt kết quả đánh giá của ban cán sự lớp là khi nào?,từ ngày 17/9/2024 đến 19/9/2024
0,Sinh viên có cơ hội thực tập ở đâu?,ngoài học bổng truyền thống còn có học bổng của khoa dành cho sinh viên có hoàn cảnh khó khăn
0,Cơ cấu tổ chức của phòng gồm những ai?,hỗ trợ các đơn vị xây dựng và triển khai các dự án hợp tác quốc tế và hợp tác với doanh nghiệp trong đào tạo
1,Sinh viên có thể được xếp lớp học như thế nào trong chương trình đào tạo văn bằng hai,dựa trên bản xét miễn môn học sinh viên sẽ được xếp vào lớp học phù hợp
1,đối tượng nào được đăng ký học phần kỳ 3?,"áp dụng cho tất cả sinh viên hệ chính quy, tập trung, bằng 2, liên thông, song bằng kv"
0,Tầng 3 của thư viện có những phòng gì?,sử dụng cơ sở vật chất của nhà trường như hội trường lớp học phòng thí nghiệm
0,Bằng đại học do trường nào cấp và có được công nhận tại Việt Nam không?,Sản xuất sản phẩm chịu lửa sản phẩm từ plastic thủy tinh đất set.
1,Ban quản lý ký túc xá có nhiệm vụ gì liên quan đến vệ sinh môi trường,ban quản lý ký túc xá thực hiện công tác vệ sinh môi trường và vệ sinh an toàn thực phẩm trong ký túc xá
1,3 lĩnh vực được trường bồi dưỡng nghiệp vụ giám sát thi công xây dựng công trình là gì?,công trình dân dụng công nghiệp và hạ tầng kỹ thuật giao thông thủy lợi thủy điện
1,vữa bê tông sản xuất bởi công ty có những đặc điểm gì?,có tính công tác tốt tự san phẳng mác cao đến 1500-2000 kg/cm²
0,Các khóa đào tạo kỹ sư bậc cao được tổ chức với sự hợp tác của ai?,với đội ngũ giảng viên 117 người trong đó có 3 gs 8 pgs 2 tskh 17 ts và 80 th.s khoa kiến trúc và quy hoạch là một trong những đơn vị hàng đầu về lực lượng nghiên cứu khoa học chất lượng cao
0,Sinh viên có được học về quản lý không?,ứng dụng các kiến thức toán học khoa học cơ bản nguyên lý kỹ thuật giải pháp công nghệ và quản lý
0,Trường đã nhận bao nhiêu huân huy chương kháng chiến chống Mỹ?,https://stce.huce.edu.vn/index.php/en
0,Người tốt nghiệp chuyên ngành này được cấp bằng gì?,người tốt nghiệp được cấp bằng kỹ sư tương đương trình độ bậc 7 theo khung trình độ quốc gia việt nam
1,Tổ Tiếng Anh có giảng dạy cho sinh viên tất cả các khoa không,tổ tiếng anh giảng dạy tiếng anh cho sinh viên của tất cả các khoa bộ môn trong nhà trường tham gia các chương trình hội thảo trong nước và quốc tế
0,Thư viện trường Đại học Xây dựng Hà Nội phục vụ bạn đọc bằng thiết bị gì?,đào tạo chất lượng cao hội nhập quốc tế dịch vụ chuyên nghiệp
0,Sinh viên sẽ được học tập trong môi trường như thế nào khi tham gia chương trình liên kết đào tạo này?,Hoạt động kiến trúc và tư vấn kỹ thuật có liên quan.
0,Ngành kỹ thuật cơ khí chuyên ngành máy xây dựng đào tạo về những gì?,đào tạo về thiết kế chế tạo quản lý hệ thống thiết bị cơ khí điện trong xây dựng trong sản xuất công nghiệp
1,Thời gian đào tạo của chương trình đại học liên thông là bao lâu,chương trình đào tạo được thiết kế 2.5 năm
1,các khoa ban cần làm gì trong công tác đánh giá?,cung cấp tài liệu phục vụ đánh giá kết quả rèn luyện cho các giáo viên chủ nhiệm và lớp sinh viên
0,Trung tâm hợp tác đào tạo có chương trình đào tạo thạc sĩ nào?,phòng đọc mở (tầng 3) và phòng giáo trình (tầng 5) được trang bị nhiều thiết bị với công nghệ hiện đại
1,địa chỉ trụ sở công ty ở đâu?,địa chỉ: tầng 1 và toàn bộ tầng 6 nhà a1 trường đại học xây dựng hà nội số 55 đường giải phóng quận hai bà trưng hà nội
0,Chương trình liên kết đào tạo Đại học Xây dựng Hà Nội và Đại học Mississippi có ưu điểm gì nổi bật?,Đang triển khai nhiều đề tài quan trọng phục vụ phát triển ngành xây dựng theo định hướng kinh tế tri thức ví dụ: sản xuất thanh polyme cốt sợi thay thế một phần cốt thép trong kết cấu bê tông cốt thép.
0,Các học bổng mà sinh viên ngành này có thể nhận là gì?,sinh viên có cơ hội nhận được học bổng các khóa học ngắn hạn do các nước tổ chức như nhật bản đài loan và có cơ hội tham gia các trại hè sinh viên quốc tế
0,Phòng chịu trách nhiệm vệ sinh ở đâu?,chủ trì tổ chức các hoạt động trông giữ xe ô tô của cán bộ giảng viên và những người có nhu cầu theo quy định của trường
0,Cán bộ trường đã xây dựng chương trình đào tạo có đặc điểm gì?,giảng viên và sinh viên của khoa cũng thường xuyên được cử đi tham dự các hội thảo quốc tế tham gia các cuộc thi quốc tế và luôn giành các giải thưởng cao
0,Các chuyên ngành liên kết đào tạo trong chương trình này là gì?,Sản xuất xi măng vôi và thạch cao.
0,Cơ hội việc làm cho sinh viên ngành mỹ thuật đô thị là gì?,nếu muốn gắn thiết bị nhớ ngoài như usb phải được sự đồng ý của cán bộ phòng máy
0,Kế hoạch bổ sung và sửa chữa cơ sở vật chất của phòng được thực hiện như thế nào?,giúp hiệu trưởng thực hiện nhiệm vụ phòng ngừa và đấu tranh chống tham nhũng theo quy định của pháp luật về phòng chống tham nhũng
0,Trung tâm hợp tác đào tạo và tư vấn quốc tế coi giá trị cốt lõi là gì?,phục vụ bạn đọc trên các trang thiết bị tự động
1,công ty được thành lập theo quyết định nào?,theo quyết định số 4652qđbgdđttccb ngày 02112000 của bộ trưởng bộ giáo dục và đào tạo
1,sinh viên đào tạo đại học liên thông vlvh cần học những môn gì bổ sung?,sinh viên phải học bổ sung các môn học còn thiếu so với các môn học yêu cầu ở trình độ cao đẳng của ngành chuyên ngành đăng ký
1,những sinh viên nào được phép đăng ký học lại để cải thiện điểm?,"sinh viên có điểm tổng kết học phần loại f, d, d+ và điểm quá trình từ 5 trở lên"
0,Liên hệ với khoa Kiến trúc và Quy hoạch qua thông tin nào?,mỗi khóa học sẽ được thiết kế trong vòng 3 tháng với các chuyên đề thực tế nâng cao thuộc lĩnh vực thi công công trình.
0,Quy định khi vào phòng máy cần đeo gì?,khung chương trình đào tạo đáp ứng chuẩn đầu ra của chương trình đào tạo cử nhân mỹ thuật đô thị nhóm các môn học
0,Phòng thực hiện nhiệm vụ gì trong công tác tiếp công dân?,chủ trì phối hợp với các đơn vị có liên quan tổ chức quản lý các gói thầu dịch vụ trông giữ xe dịch vụ căng tin dịch vụ cho thuê mặt bằng trong trường
0,Trường Đại học Xây dựng Hà Nội nhận bao nhiêu bằng khen của công đoàn cấp trên?,lập kế hoạch tổ chức thực hiện công tác quản lý biên tập xuất bản và quảng bá tạp chí khoa học công nghệ xây dựng
1,thông báo này được ký bởi ai?,pgs.ts hoàng tùng
1,trường đã đào tạo ngắn hạn và cấp chứng nhận cho bao nhiêu học viên từ tháng 6 năm 2005 đến nay?,hơn 20.000 học viên
0,Phòng chịu trách nhiệm gì trong việc chuẩn bị dự án đầu tư?,phòng quản lý đào tạo có chức năng tham mưu giúp hiệu trưởng quản lý công tác đào tạo đại học sau đại học và phát triển các chương trình
1,sinh viên cần xem thời khóa biểu và thời gian đăng ký ở đâu?,xem tại địa chỉ https://sinhvien.huce.edu.vn
1,"nếu gặp vấn đề về tài khoản đăng nhập, sinh viên cần liên hệ ai?",liên hệ qua điện thoại 024 38630001 hoặc email ttcntt@huce.edu.vn
1,Ngày ban hành quyết định về việc công nhận và sử dụng chứng chỉ ngoại ngữ là khi nào,hà nội ngày 2 tháng 1 năm 2022
1,sinh viên cần đóng học phí trong khoảng thời gian nào?,từ ngày 06/05/2024 đến hết 15h ngày 10/05/2024
1,sinh viên có thể đăng ký học phần qua phương thức nào?,qua website https://sinhvien.huce.edu.vn
1,hình thức tuyển sinh của các ngành đào tạo vlvh là gì?,hình thức tuyển sinh: xét tuyển
1,thời gian duyệt kết quả đánh giá của giáo viên chủ nhiệm là khi nào?,từ ngày 20/9/2024 đến 23/9/2024
0,Viện KHCN CTT khảo sát địa chất cho công trình nào?,triển khai các hoạt động nghiên cứu khoa học và phát triển công nghệ trong lĩnh vực các dạng kết cấu mới vật liệu môi trường và công nghệ thi công tiên tiến
0,Cơ chế hoạt động của phòng trong lĩnh vực đầu tư là gì?,phó trưởng phòng được ký thừa lệnh hiệu trưởng những văn bản do trưởng phòng uỷ quyền
0,Khoa mở rộng hợp tác với những đối tác quốc tế ở đâu?,công trình dân dụng công nghiệp và hạ tầng kỹ thuật giao thông thủy lợi thủy điện.
0,Đánh giá chung về đội ngũ giảng viên của khoa Kiến trúc và Quy hoạch?,trường đại học xây dựng hà nội sẽ hợp tác mở các lớp đào tạo kỹ sư bậc cao với các kỹ sư dày dạn kinh nghiệm.
1,quyết định này được ký vào ngày nào?,ngày 2 tháng 1 năm 2022
0,Phòng có vai trò gì trong việc tổ chức các dịch vụ trong trường?,chủ trì giúp hiệu trưởng về công tác tiếp công dân công tác giải quyết khiếu nại tố cáo và công tác phòng chống tham nhũng
1,ai thông báo cho sinh viên về việc miễn giảm học phần,các khoa ban và giáo viên chủ nhiệm
1,email hỗ trợ vấn đề khác là gì?,sdh@huce.edu.vn
1,quyết định số 1396/qđ-ttg được ký vào ngày nào?,ngày 13 tháng 8 năm 2021
0,Sinh viên còn có thể nhận những học bổng cụ thể nào khác?,theo kết quả khảo sát năm 2016 đến nay sinh viên tốt nghiệp 97% làm đúng nghề 3% làm nghề khác
1,Các cựu sinh viên của trường hiện nay làm việc ở đâu,"nhiều cựu sinh viên của trường đang giữ trọng trách ở các cơ quan từ trung ương đến địa phương, các công ty, tổng công ty, các tập đoàn kinh tế"
0,Khoa tổ chức các hoạt động nào để hỗ trợ nghiên cứu khoa học cho sinh viên?,60 sinh viên tốt nghiệp làm tư vấn thiết kế xây dựng. 20 sinh viên tốt nghiệp chỉ đạo thi công hoặc tư vấn giám sát tại công trường. 3 làm lập trình viên
1,sinh viên cần làm gì nếu có câu hỏi về đăng ký học phần?,liên hệ qua điện thoại hoặc email hỗ trợ
1,tài khoản đăng nhập của sinh viên là gì?,mã kỹ sư kiến trúc sư
1,địa bàn mở lớp của trường có ở những tỉnh thành nào?,hà nội hải phòng nam định thanh hoá quảng ninh hải dương việt trì vĩnh yên yên bái hoà bình điện biên quảng bình nha trang tuy hoà bình định tp. hồ chí minh
0,Mức điểm tối đa cho bài báo tiếng Anh là bao nhiêu?,được thành ủy hà nội 4 lần tặng cờ đảng bộ vững mạnh
1,thông báo này được ký bởi ai?,pgs.ts hoàng tùng
0,Sinh viên ngành này sẽ được trang bị những kiến thức gì?,thời gian đào tạo là 5 năm
1,quyết định công nhận trường đại học xây dựng hà nội là cơ sở bồi dưỡng nghiệp vụ giám sát thi công xây dựng công trình được ra vào tháng nào?,tháng 6 năm 2005
0,Sinh viên sẽ được trang bị bao nhiêu khối kiến thức trong chương trình đào tạo?,sinh viên có cơ hội học tập chuyển tiếp ở các trường nước ngoài theo chương trình châu âu
0,Sinh viên tốt nghiệp ngành này có thể học cao học ở đâu?,chuyên ngành tin học xây dựng nằm trong ngành kỹ thuật xây dựng của trường đại học xây dựng hà nội
0,Bộ môn tiếng Anh có các hình thức đào tạo nào cho sinh viên hệ chính quy?,yêu cầu đối với người học: đã có bằng tốt nghiệp đại học đào tạo: sinh viên sẽ được miễn các môn học đã học ở trình độ đại học đạt từ điểm 5 trở lên và phù hợp với chương trình khung của ngành chuyên ngành đăng ký.
1,Trường Đại học Xây dựng Hà Nội đã có bao nhiêu nhà giáo được phong tặng danh hiệu nhà giáo nhân dân,trường đã có 9 nhà giáo được phong tặng danh hiệu nhà giáo nhân dân
0,Khoa kiến trúc và quy hoạch được thành lập vào năm nào?,nghị quyết số 80nqhđtđhxdhn hà nội ngày 24 tháng 4 năm
1,thời gian đăng ký học phần lần thứ hai là khi nào?,từ 14h00 ngày 01/7/2024 đến 10h00 ngày 03/7/2024
0,Kỹ sư có thể tham gia vào các công việc nào trong đô thị?,chương trình đào tạo theo chuẩn quốc tế tạo điều kiện cho sinh viên du học sau đại học tại các nước tiên tiến
1,điều kiện để được xét và công nhận tốt nghiệp là gì,chứng chỉ giáo dục quốc phòng an ninh và hoàn thành các học phần giáo dục thể chất
0,"Trường đã nhận bằng khen nào từ Đảng ủy Khối các trường Đại học, Cao đẳng Hà Nội?",tạp chí bằng tiếng anh đã được công nhận là tạp chí quốc gia uy tín theo quyết định số 151/qđ-hđql.nafosted
1,tỷ lệ viên chức hành chính so với tổng số cán bộ là bao nhiêu phần trăm?,16.47%
1,"nếu sinh viên đã có bằng cử nhân, họ có thể làm gì tiếp theo?",tiếp tục học để lấy bằng kỹ sư kiến trúc sư
1,thời gian đăng ký bảo lưu là khi nào?,từ 29/04/2024 đến 05/05/2024
0,Thông tin liên hệ khoa Kiến trúc và Quy hoạch là gì?,sinh viên nào vi phạm một trong những điều quy định trên sẽ bị đình chỉ học tại phòng máy và bị xử lý kỷ luật theo
0,Các vật dụng bị cấm mang vào phòng máy là gì?,nhóm môn học cơ sở ngành gồm các môn học về lịch sử và lý thuyết mỹ thuật thiết kế cơ sở nghệ thuật thị giác không gian
0,Mục tiêu của chương trình đào tạo kỹ năng nghề nghiệp là gì?,các đề tài đã nghiệm thu cuối năm 2014 nghiệm thu 9 đề tài cấp trường 7 tốt 2 khá và 2 cấp trường trọng điểm 1 tốt 1 khá
1,"Trường Đại học Xây dựng Hà Nội đã đào tạo bao nhiêu kỹ sư, kiến trúc sư","trường đã đào tạo cho đất nước trên 60.000 kĩ sư, kiến trúc sư"
0,Danh sách cán bộ viên chức hiện tại của phòng là gì?,trưởng phòng quản lý đào tạo được phép thừa lệnh hiệu trưởng ký và đóng dấu của trường trong phạm vi công tác được giao
1,sinh viên phải nộp hồ sơ miễn giảm học phần trước thời gian nào,trước ngày 13/09/2024
1,sinh viên có thể hoãn thi vắng thi trong trường hợp nào?,sinh viên có thể hoãn thi vắng thi trong trường hợp trùng ca thi hoặc do điều kiện bất khả kháng
1,thời hạn nộp lệ phí cấp chứng chỉ kết thúc vào giờ nào,hết 15h ngày 26/09/2024
1,Tổ Tiếng Pháp giảng dạy cho sinh viên chương trình nào,tổ tiếng pháp đào tạo tiếng pháp cho sinh viên trong chương trình pfiev xf và kdf
1,Khu ký túc xá bao gồm những công trình gì,ký túc xá gồm có 02 dãy nhà 4 tầng và 01 tòa nhà 5 tầng khuôn viên gồm cả nhà ăn và nhà thi đấu thể thao sân bóng rổ
0,Khoa Kiến trúc và Quy hoạch được thành lập vào năm nào?,trường đã chủ trương xây dựng và phát triển hệ đào tạo liên tục theo đặt hàng của bộ xây dựng.
0,Sinh viên có cơ hội tham gia chương trình nào quốc tế?,tham gia đội sinh viên tình nguyện của khoa trường
1,sinh viên cần làm gì trong công tác đánh giá?,tự đánh giá kết quả rèn luyện bản thân trên phần mềm
1,Liên hệ với văn phòng Bộ môn Tiếng Anh ở đâu,liên hệ văn phòng bộ môn tiếng anh phòng 511a nhà a1 đại học xây dựng số 55 đường giải phóng quận hai bà trưng thành phố hà nội
0,Phòng thực hiện kiểm kê tài sản theo định kỳ như thế nào?,tham mưu cho hiệu trưởng có quyết định điều chỉnh khắc phục các sai phạm kịp thời
0,Các công nghệ mà sinh viên chuyên ngành này có thể sử dụng là gì?,được trang bị kiến thức liên quan đến chuyên ngành xây dựng cầu đường
0,Kết quả khảo sát việc làm của sinh viên ngành này từ năm 2016 đến nay là gì?,học bổng csc 120 triệu đèo cả 50 triệu lotte maeda tedi
