0,Viện KHCN CTT khảo sát về lĩnh vực nào?,tham gia đấu thầu các đề tài dự án nckh có nguồn vốn từ ngân sách và tăng cường liên kết với các đơn vị trong và ngoài nước
0,Chương trình đào tạo ngành kỹ thuật môi trường được thiết kế theo phương pháp nào?,kỹ thuật điện tử mạch điện tử và các linh kiện điện tử kỹ thuật điều khiển tự động hóa các bộ biến đổi điện năng hệ thống truyền động điện vi điều khiển plc
0,Phòng chịu trách nhiệm gì trong việc tổ chức hội nghị sự kiện?,bắt giữ và lập biên bản những người phạm pháp quả tang đối tượng có lệnh truy nã bàn giao cho công an phường xử lý
1,Trường Đại học Xây dựng Hà Nội đạt chuẩn kiểm định chất lượng của tổ chức nào,trường đại học xây dựng hà nội đạt chuẩn kiểm định chất lượng của hội đồng cấp cao đánh giá nghiên cứu và giáo dục đại học (hceres) của pháp
1,các ngành đào tạo hệ vừa làm vừa học tại trường là gì?,tất cả các ngành và chuyên ngành đào tạo hệ vừa làm vừa học của trường đhxdhn
1,sinh viên cần thay đổi mật khẩu như thế nào?,thay đổi mật khẩu mặc định để đảm bảo an toàn thông tin cá nhân
0,Phòng Quản lý Đầu tư có chức năng chính là gì?,phòng quản lý đào tạo được thành lập theo quyết định số 1031qđđhxdhn ngày 01 tháng 11 năm 2021 trên cơ sở sáp nhập các bộ phận đào tạo
1,sinh viên có thể làm việc tại cơ quan nào sau khi tốt nghiệp?,tại các cơ quan quản lý nhà nước như sở xây dựng sở giao thông sở quy hoạch kiến trúc sở tài nguyên môi trường và các ban ngành chuyên môn
0,Tỷ lệ sinh viên tốt nghiệp loại xuất sắc là bao nhiêu?,có cơ hội nhận học bổng của trường khoa và các đơn vị tài trợ
0,Ngành này có lịch sử đào tạo bao lâu?,với lịch sử 60 năm đào tạo và phát triển sự phát triển của chuyên ngành luôn đồng hành cùng sự nghiệp công nghiệp hóa hiện đại hóa
0,Chuyên ngành Tin học xây dựng được thành lập vào năm nào?,ngành kỹ thuật xây dựng công trình giao thông chuyên ngành xây dựng cầu đường được thành lập và tuyển sinh từ năm 1956
1,sinh viên có thể đăng ký học gì khi đã có bằng cử nhân kỹ sư kiến trúc sư?,đăng ký học tiếp lên trình độ thạc sĩ
0,Ngành kỹ thuật cơ khí chuyên ngành máy xây dựng đào tạo về những gì?,đào tạo về thiết kế chế tạo quản lý hệ thống thiết bị cơ khí điện trong xây dựng trong sản xuất công nghiệp
0,Phòng thực hiện công việc gì về việc ký kết hợp đồng?,đội ngũ cán bộ nhân viên của phòng gồm 36 người 2 lãnh đạo phòng và 34 cán bộ nhân viên được chia thành 3 tổ đảm nhận 3 nhóm công việc chính
0,Nghị quyết nào thông qua chủ trương sáp nhập bộ môn giáo dục thể chất và khoa giáo dục quốc phòng?,hướng tới chuẩn đầu ra quốc tế nhằm hướng tới chuẩn đầu ra quốc tế
0,Phòng thực hiện quản lý nhà thầu như thế nào?,lập và quản lý kế hoạch đào tạo tối ưu hóa sử dụng đội ngũ cán bộ và cơ sở vật chất trong công tác đào tạo quản lý và hỗ trợ người
0,Đội ngũ cán bộ của khoa Kiến trúc và Quy hoạch hiện tại có bao nhiêu người?,triển khai quyết định trên từ tháng 6 năm 2005 đến nay trường đã đào tạo ngắn hạn và cấp chứng nhận cho hơn 20.000 học viên.
1,sinh viên có thể học tiếp lên thạc sĩ sau khi có bằng gì?,cử nhân kỹ sư kiến trúc sư
0,Thư viện trường Đại học Xây dựng Hà Nội phục vụ cho những hoạt động gì?,trung tâm hợp tác đào tạo và tư vấn quốc tế iccec được thành lập theo quyết định số 406qđtccb ngày 02 tháng 6 năm 2006
0,Viện Quy hoạch và Kiến trúc Đô thị chuyên trách về lĩnh vực nào?,năm 1989 tách khoa vlxd ktvs thành khoa kỹ thuật môi trường
0,Viện Quy hoạch và Kiến trúc Đô thị được thành lập vào ngày nào?,mã số doanh nghiệp 0100522320 giấy chứng nhận đăng ký hoạt động khcn số a724 do bộ khcn cấp ngày 20.10
1,sinh viên cần làm gì để đăng ký học các học phần chưa đạt?,đăng nhập mã sinh viên và mật khẩu sinh viên bậc cử nhân để đăng ký học các học phần chưa đạt hoặc cải thiện điểm học phần bậc cử nhân
1,sinh viên có thể liên hệ với phòng nào để được hỗ trợ trong quá trình đánh giá?,liên hệ phòng ctct qlsv
1,sinh viên muốn chuyển hệ đào tạo sẽ nộp hồ sơ ở đâu?,sinh viên sẽ nộp hồ sơ gốc phiếu điểm các môn học đã tích luỹ được ở hệ chính quy
1,sinh viên không được dự thi nếu chưa hoàn thành nghĩa vụ gì?,sinh viên không được dự thi nếu chưa hoàn thành nghĩa vụ về học phí với nhà trường
0,Ngành kỹ thuật cơ khí chuyên ngành máy xây dựng đóng vai trò gì trong xã hội?,các cán bộ kỹ thuật ngành kỹ thuật cơ khí chuyên ngành máy xây dựng luôn giữ vai trò quan trọng không thể thiếu trong xã hội
1,sinh viên đào tạo văn bằng hai vlvh sẽ được xếp lớp như thế nào?,dựa trên bản xét miễn môn học sinh viên sẽ được xếp vào lớp học phù hợp
1,thời hạn gửi phản hồi đính chính thông tin là ngày nào,trước ngày 30/09/2024
1,Trường Đại học Xây dựng Hà Nội đào tạo từ bậc nào đến bậc nào,trường đào tạo từ bậc đại học đến tiến sĩ
1,thời gian sinh viên khóa 64 trở về trước phải gửi danh sách đăng ký học phần là khi nào?,trước ngày 18/04/2024
1,tỷ lệ phó giáo sư trong đội ngũ giảng viên là bao nhiêu phần trăm?,12.98%
0,Phòng thực hiện nhiệm vụ gì liên quan đến văn bản quản lý của trường?,phối hợp với các đơn vị liên quan trong việc quản lý sửa chữa bảo trì nhà cửa hệ thống điện điện lạnh điện thoại hệ thống cấp thoát nước thiết bị vệ sinh
1,Nhiều cựu sinh viên của trường được phong tặng danh hiệu gì,nhiều người được phong tặng danh hiệu anh hùng
1,Yêu cầu đối với người học chương trình đại học liên thông là gì,yêu cầu đối với người học: đã có bằng tốt nghiệp cao đẳng thuộc khối kỹ thuật
1,sinh viên học tại đại học mississippi bao lâu?,2 năm
1,Bộ môn Tiếng Anh đào tạo tiếng Anh như thế nào đối với hệ vừa làm vừa học,đối với học viên hệ vừa làm vừa học: đào tạo tiếng anh cơ bản
1,điều gì được quy định trong điều 2 của quyết định này?,sử dụng chứng chỉ ngoại ngữ của các cơ sở giáo dục được bộ giáo dục và đào tạo công nhận để xét miễn học miễn thi các học phần tiếng anh
0,Mã tuyển sinh chuyên ngành kinh tế và quản lý bất động sản là gì?,ngành kiến trúc nội thất mã tuyển sinh 7580103
1,phương thức học cho các môn học không mở ở học kỳ 3 là gì?,học lại từ đầu và bảo lưu điểm quá trình thuộc học kỳ 3
1,trường đại học mississippi được thành lập khi nào?,năm 1844
1,công tác dạy và học trực tuyến sử dụng phần mềm nào,triển khai theo kế hoạch đã bố trí qua microsoft teams
1,nếu sinh viên vắng thi mà không có lý do chính đáng thì sẽ ra sao?,nếu sinh viên vắng thi mà không có lý do chính đáng thì coi như đã tham dự kỳ thi và phải nhận điểm 0
1,các khoa/ban cần làm gì trong công tác đánh giá?,cung cấp tài liệu phục vụ đánh giá kết quả rèn luyện cho các giáo viên chủ nhiệm và lớp sinh viên
1,tỷ lệ viên chức hành chính so với tổng số cán bộ là bao nhiêu?,tỷ lệ viên chức hành chính là 17.81%
0,Tầng 2 của thư viện có chức năng gì?,văn phòng tại tầng 5 nhà thí nghiệm 10 tầng trường đại học xây dựng hà nội
1,các lớp học phần theo phương thức bảo lưu đqt có lịch thi như thế nào,lịch thi các lớp học phần theo phương thức bảo lưu đqt sẽ do các bộ môn quyết định và phổ biến đến sinh viên
0,Số điện thoại liên hệ của phòng bảo vệ là gì?,liên hệ văn phòng: phòng 219 nhà a1 trường đại học xây dựng hà nội điện thoại: 024.38.69 14 54
1,công ty sản xuất máy khai thác mỏ và máy xây dựng không?,sản xuất máy khai thác mỏ và xây dựng máy sản xuất vật liệu xây dựng
0,Nhiệm vụ xây dựng và trình phê duyệt của phòng bảo vệ là gì?,phòng hành chính tổng hợp tham mưu giúp việc hiệu trưởng về công tác hành chính kế hoạch tổng hợp quản lý nội vụ trường và công tác thi đua
0,Môi trường làm việc của ngành mỹ thuật đô thị như thế nào?,khi kết thúc ca học thực hành phải tắt máy sắp xếp màn hình chuột bàn phím ghế ngay ngắn theo quy định làm tốt vệ
0,Viện công nghệ cao Việt Nhật được thành lập theo quyết định nào?,quyết định thành lập: qđtl số 444tccb ngày 14/06/1990
1,sinh viên có thể nhận bằng cử nhân trong bao nhiêu ngành?,8 ngành
1,sinh viên có thể ra khỏi phòng thi trong trường hợp nào?,sinh viên có thể ra khỏi phòng thi sau khi hết thời gian làm bài và phải nộp bài thi giấy nháp đề thi
0,Người tốt nghiệp chuyên ngành này sẽ được cấp bằng gì?,cung cấp cho người học kiến thức về thiết kế kiến trúc tổ chức không gian và thiết kế nội thất chuyên nghiệp
0,Tổng biên tập tạp chí có quyền gì?,đoàn thanh niên cộng sản hồ chí minh trường được trung ương đoàn tncs hồ chí minh và thành đoàn hà nội tặng
0,Chương trình học cho phép học tiếp bậc cao hơn ở lĩnh vực nào?,cán bộ lớp phải bàn giao phòng máy cho giảng viên hướng dẫn
0,Chức năng của viện công nghệ cao Việt Nhật là gì?,cơ quan ra qđtl chuyển đổi: bộ giáo dục và đào tạo
0,Vai trò của phòng trong việc chuẩn bị mặt bằng dự án là gì?,quản lý và hướng dẫn quy hoạch phát triển ngành và chương trình đào tạo đáp ứng nhu cầu của xã hội theo chiến lược phát triển trường và tiếp
0,Ngành kỹ thuật điện được kiểm định theo tiêu chuẩn nào?,người tốt nghiệp được cấp bằng kỹ sư tương đương trình độ bậc 7 theo khung trình độ quốc gia việt nam
0,Sinh viên có thể tham gia các hoạt động gì?,quỹ học bổng cho sinh viên đạt thành tích xuất sắc sinh viên vượt khó
1,sinh viên có thể học tiếp lên trình độ thạc sĩ ở ngành nào?,kỹ sư kiến trúc sư
0,Viện KHCN CTT đào tạo về lĩnh vực gì?,nhiệm vụ nghiên cứu khoa học phát triển và ứng dụng công nghệ mới chuyển giao công nghệ
1,ai là người ký thông báo này?,nguyễn bình hà
1,giáo viên chủ nhiệm phê duyệt kết quả đánh giá ở đâu?,trên phần mềm tại địa chỉ https://eoffice.huce.edu.vn
0,Khoa đã thành lập các lớp đào tạo theo ngôn ngữ nào và vào những năm nào?,tháng 6 năm 2005 bộ xây dựng đã ra quyết định công nhận trường đại học xây dựng hà nội.
1,ai là người phụ trách công tác đánh giá kết quả rèn luyện?,phạm minh châu chuyên viên phụ trách
0,Ban quản lý ký túc xá có trách nhiệm quản lý những cơ sở vật chất nào trong khu vực ký túc xá,cơ cấu tổ chức bộ môn ngoại ngữ gồm hai tổ: tổ tiếng anh và tổ tiếng pháp với 25 cán bộ giảng dạy và 01 thư ký bộ môn.
1,thời gian hoàn thành báo cáo kết quả thực hiện công tác đánh giá là khi nào?,trước ngày 31/03/2024
1,thông tin hỗ trợ về tài khoản đăng nhập cổng thông tin sinh viên liên hệ ở đâu?,qua điện thoại 024 38630001 hoặc email ttcntt@huce.edu.vn
0,Viện công nghệ cao Việt Nhật thực hiện các khóa đào tạo nào?,thiết kế công trình thủy lợi thủy điện
1,"khi sinh viên gặp vấn đề về tài khoản đăng nhập, họ sẽ liên hệ vào thời gian nào?",trong giờ hành chính
1,sinh viên cần cài đặt phần mềm nào để học,phần mềm ms teams
1,sinh viên muốn đăng ký tuyển sinh hệ vừa làm vừa học phải làm gì?,đăng ký tuyển sinh: đào tạo vừa làm vừa học tại địa chỉ http://tuyensinh.huce.edu.vn/daihoc
1,thời gian học tại đại học xây dựng hà nội bao lâu?,2 năm
0,"Sau khi tốt nghiệp, sinh viên được cấp bằng gì?",được đánh giá theo tiêu chuẩn kiểm định abet (accreditation board for engineering and technology) của hoa kỳ
0,Tạp chí Khoa học Công nghệ Xây dựng sử dụng phần mềm nào cho quy trình gửi bài và phản biện?,huân chương lao động hạng nhất năm 1986 huân chương lao động hạng nhì năm 1983
1,"Quy định nào về việc xét miễn học, miễn thi các học phần tiếng Anh dựa trên chứng chỉ ngoại ngữ",sử dụng chứng chỉ ngoại ngữ của các cơ sở giáo dục được bộ giáo dục và đào tạo công nhận để xét miễn học miễn thi các học phần tiếng anh công nhận đạt trình độ ngoại ngữ theo tiến trình học tập và chuẩn đầu ra ngoại ngữ
1,sinh viên có thể học tiếp bậc sau đại học sau khi tốt nghiệp không?,có thể học chuyển tiếp thẳng lên tiến sĩ
1,phòng nào chủ trì lập kế hoạch triển khai công tác đánh giá?,phòng ctctqlsv
1,giáo viên chủ nhiệm nhận dữ liệu từ đâu để đánh giá kết quả rèn luyện?,nhận dữ liệu từ khoa/ban
1,công ty có văn phòng đại diện phía nam không?,công ty có văn phòng đại diện phía nam địa chỉ: 43h hồ văn huê p9 quận phú nhuận tp. hồ chí minh
1,giáo viên chủ nhiệm có trách nhiệm gì trong việc đánh giá?,phê duyệt kết quả đánh giá rèn luyện của sinh viên lớp mình phụ trách
1,công ty hoạt động trong những lĩnh vực nào?,hoạt động kiến trúc và tư vấn kỹ thuật có liên quan
1,công ty sản xuất các sản phẩm từ bê tông và thạch cao không?,sản xuất bê tông và các sản phẩm từ xi măng và thạch cao
1,chứng chỉ ngoại ngữ có thể được sử dụng để làm gì theo quyết định này?,để xét miễn học miễn thi các học phần tiếng anh công nhận đạt trình độ ngoại ngữ theo tiến trình học tập và chuẩn đầu ra ngoại ngữ
0,Sinh viên có thể tham gia những hoạt động gì để rèn luyện kỹ năng mềm?,cơ hội tham gia các hoạt động để rèn luyện kỹ năng mềm trong các hoạt động đoàn thể như sinh viên tình nguyện câu lạc bộ robocon hoạt động văn hóa và thể thao
1,phần mềm nào sinh viên cần cài đặt để học trực tuyến,phần mềm ms teams
0,Phương pháp cdio gồm những bước nào?,nhiều kỹ sư xây dựng ra trường không am hiểu về kinh tế quản lý và đầu tư
0,Phòng tham mưu như thế nào trong việc xây dựng chiến lược đào tạo?,chủ trì thực hiện các hoạt động xúc tiến các thoả thuận đầu tư dự án
1,sinh viên có thể liên hệ với phòng nào để được hỗ trợ trong quá trình đánh giá?,liên hệ phòng ctct qlsv
1,các chuyên ngành thuộc ngành kỹ thuật xây dựng là gì?,cơ sở hạ tầng giao thông kỹ thuật đô thị kỹ thuật công trình thủy vật liệu xây dựng
0,Khoa có bao nhiêu giảng viên và chuyên viên?,giảng dạy giáo dục quốc phòng và an ninh cho sinh viên đại học cao đẳng và liên thông
1,danh mục các lớp môn học được mở ở đâu?,công bố trên website https://sinhvien.huce.edu.vn
0,Sinh viên có thể tự chọn môn gì trong chương trình giáo dục thể chất?,giảng viên và sinh viên của khoa cũng thường xuyên được cử đi tham dự các hội thảo quốc tế
1,cần nộp những giấy tờ gì để làm thủ tục miễn giảm,bản photo chứng chỉ bảng điểm có công chứng
0,Chương trình đào tạo tiếng Anh dành cho học viên hệ vừa học vừa làm là gì?,chức năng ban quản lý ký túc xá tham mưu giúp hiệu trưởng quản lý toàn bộ hoạt động ký túc xá sinh viên của trường. nhiệm vụ quyền hạn quản lý ký túc xá sinh viên theo quy định hướng dẫn sinh viên học viên thực hiện tốt nội quy bố trí phòng ở cho sinh viên học viên đảm bảo khoa học thuận lợi cho công tác quản lý của trường và học tập của sinh viên.
1,ai là chủ tịch hội đồng quản trị của công ty?,chủ tịch hội đồng quản trị: th.s nguyễn văn khánh
0,Thời gian đào tạo chuyên ngành này kéo dài bao lâu?,thời gian đào tạo là 5 năm
0,Cơ quan ra quyết định chuyển đổi Viện KHCN CTT là gì?,nghiên cứu khoa học phát triển và ứng dụng công nghệ mới chuyển giao công nghệ trong các lĩnh vực xây dựng công trình hạ tầng kỹ thuật
0,Phó tổng biên tập có quyền gì?,trên 600 huy chương vì sự nghiệp giáo dục cho các cán bộ của trường
0,Khu vực ký túc xá có đảm bảo an ninh và vệ sinh môi trường cho sinh viên không?,đối với sinh viên chính quy: đào tạo tiếng anh cơ bản làm nền tảng cho các khóa học chứng chỉ như toeic ielts; mục tiêu đầu ra toeic tiếng anh chuyên ngành được giảng dạy từ năm thứ đối với sinh viên kỹ sư chất lượng cao: đào tạo tiếng pháp delf b1 và tiếng anh cơ bản toeic.
0,Mọi hoạt động của thư viện được thực hiện dưới sự chỉ đạo của ai?,đẩy mạnh công tác liên kết đào tạo trao đổi khoa học công nghệ với các nước tiên tiến tạo nguồn nhân lực đạt chuẩn khu vực và quốc tế
1,Ban quản lý ký túc xá hoạt động dưới sự chỉ đạo của ai,ban quản lý ký túc xá hoạt động dưới sự chỉ đạo trực tiếp của đảng ủy và ban giám hiệu trường
1,Điều kiện để sinh viên chính quy chuyển sang hệ vừa làm vừa học là gì,sinh viên có nguyện vọng chuyển sang vlvh cần có đơn và được sự đồng ý của trưởng phòng đào tạo
1,quyết định này áp dụng cho những cơ sở giáo dục nào?,các cơ sở giáo dục được bộ giáo dục và đào tạo công nhận
1,thông tin hỗ trợ về đăng ký học phần có thể liên hệ ở đâu?,qua điện thoại 024 38696654 (trong giờ hành chính) hoặc email daotao@huce.edu.vn
0,Bộ môn tiếng Anh tại Đại học Xây dựng Hà Nội có nhiệm vụ nào liên quan đến giảng dạy?,quy mô tuyển sinh: 200 sinh viên/năm học ngành và chuyên ngành đào tạo: các ngành và chuyên ngành đào tạo vừa làm vừa học của trường đhxdhn hình thức tuyển sinh: xét tuyển thời điểm thi tuyển sinh: theo kế hoạch tuyển sinh hàng năm
0,Giảng viên và sinh viên của khoa thường xuyên tham gia những hoạt động nào?,cán bộ của trường đã xây dựng chương trình đào tạo hấp dẫn có tính hệ thống đáp ứng nhiều mặt của nghề xây dựng.
0,"Phòng chịu trách nhiệm gì về nội quy, quy chế tài sản?",chủ trì tổ chức các hoạt động thanh tra theo sự chỉ đạo của hiệu trưởng trong phạm vi trách nhiệm quản lý của hiệu trưởng
0,Sinh viên có thể nhận học bổng từ đâu?,năng lực tự học và phát triển nghề nghiệp trong lĩnh vực kỹ thuật môi trường
0,Trung tâm sử dụng cơ sở vật chất của trường đại học nào?,tầng 3: phòng đọc mở (300 chỗ ngồi với diện tích 690 m2); phòng quản trị hệ thống; phòng máy chủ
0,Mục tiêu của khoa trong việc đào tạo sinh viên là gì?,thuộc các lĩnh vực xây dựng kiến trúc quy hoạch và quản lý.
0,Vai trò của phòng trong việc xúc tiến đầu tư là gì?,tham mưu phối hợp với các đơn vị liên quan xây dựng chiến lược đào tạo của trường chủ trì phối hợp thực hiện kế hoạch phát triển công tác
0,Tạp chí Khoa học Công nghệ Xây dựng có bao nhiêu số xuất bản mỗi năm?,trở thành một trung tâm đào tạo nckh chuyển giao công nghệ lớn uy tín của đất nước
0,Tầng 5 của thư viện có phòng gì?,chương trình liên kết đào tạo dự bị đại học với các trường đại học của chlb đức
0,Khoa có phương châm gì trong việc gắn kết giữa học tập và thực tế?,hiện nay trường đang mở các lớp đào tạo liên tục sau: bồi dưỡng nghiệp vụ giám sát thi công xây dựng công trình dân dụng công nghiệp và hạ tầng kỹ thuật.
0,Sinh viên có thể học chuyển đổi sang chuyên ngành khác không?,học bổng viettinbank 3 triệu đồng
0,Sinh viên có cơ hội tham gia khóa học ngoại ngữ nào?,cơ hội tham gia các khóa học ngoại ngữ miễn phí nhật hàn quốc tại trường đại học xây dựng hà nội và doanh nghiệp liên kết
1,công ty có những xí nghiệp nào?,công ty có xí nghiệp tự động hóa thiết kế và các xí nghiệp thiết kế kiến trúc kết cấu cơ điện công trình me
1,sinh viên pfiev có thể làm việc tại các tổ chức nào?,tại các trường đại học viện nghiên cứu tổ chức phi chính phủ
0,Chương trình liên kết đào tạo này có những cơ hội học bổng nào dành cho sinh viên?,Chuẩn bị mặt bằng xây dựng và hoàn thiện công trình.
0,Sinh viên sẽ được trang bị những gì để hỗ trợ học tập?,thiết kế thi công các công trình nội thất
1,Mục tiêu đầu ra của tiếng Anh đối với sinh viên chính quy là gì,mục tiêu đầu ra toeic tiếng anh chuyên ngành được giảng dạy từ năm thứ đối với sinh viên kỹ sư chất lượng cao: đào tạo tiếng pháp delf b1 và tiếng anh cơ bản toeic
1,sinh viên đào tạo văn bằng hai vlvh sẽ được miễn những môn học nào?,sinh viên sẽ được miễn các môn học đã học ở trình độ đại học đạt từ điểm 5 trở lên và phù hợp với chương trình khung của ngành chuyên ngành đăng ký
0,Bộ môn tiếng Anh tại Đại học Xây dựng Hà Nội có nhiệm vụ nào liên quan đến giảng dạy?,chương trình đào tạo được thiết kế 5 năm 10 học kỳ trong đó 9 học kỳ tích lũy học phần 1 học kỳ làm đồ án tốt nghiệp thời gian đào tạo: tối đa 10 năm
1,Các ngành và chuyên ngành đào tạo của chương trình đại học vừa làm vừa học là gì,các ngành và chuyên ngành đào tạo vừa làm vừa học của trường đhxdhn
0,Khoa kiến trúc và quy hoạch đã thiết lập quan hệ hợp tác với các trường nào?,đội ngũ cán bộ gồm 27 cb trong đó 25 cán bộ giảng dạy và 2 trợ lý khoa
0,Viện công nghệ cao Việt Nhật triển khai nghiên cứu trong lĩnh vực nào?,khảo sát địa chất đối với các công trình xây dựng
1,mật khẩu sinh viên bậc cử nhân có sử dụng để đăng ký học phần không?,"có, sinh viên đăng nhập mật khẩu sinh viên bậc cử nhân để đăng ký học các học phần"
0,Các kỹ sư xây dựng ra trường có thiếu sót gì trong kiến thức?,conceive (hình thành ý tưởng) design (thiết kế) implement (triển khai) operate (vận hành)
0,Phòng bảo vệ phối hợp xử lý vi phạm như thế nào?,thực hiện công tác tổng hợp thông tin toàn diện của trường lập báo cáo sơ kết tổng kết hàng tuần tháng quý học kỳ và năm học
